{
  "$schema": "http://json-schema.org/draft-07/schema#",
  "$id": "https://schemas.otoi.framework/personal-toi/v1.0",
  "title": "Personal TOI v1.0",
  "description": "Personal Terms of Interaction document: how an individual (with particular cognitive, communication, accessibility, and privacy needs) wants AI systems to interact with them. Validates the structured personal-TOI template format consumed by nlt-otoi/tools. Forward-compatible: unknown properties are permitted so documents can carry extensions without failing validation.",
  "type": "object",
  "required": ["metadata", "user_profile"],
  "additionalProperties": true,
  "properties": {
    "metadata": {
      "type": "object",
      "description": "Document provenance and versioning.",
      "required": ["version", "user_id"],
      "additionalProperties": true,
      "properties": {
        "version": {
          "type": "string",
          "description": "Version tag for this document's shape, e.g. \"v1.0\".",
          "examples": ["v1.0"]
        },
        "created_date": {
          "type": "string",
          "description": "ISO 8601 timestamp when the document was created."
        },
        "last_updated": {
          "type": "string",
          "description": "ISO 8601 timestamp of the last update."
        },
        "user_id": {
          "type": "string",
          "description": "Stable, possibly pseudonymous identifier for the document owner."
        },
        "tags": {
          "type": "array",
          "description": "Freeform labels (e.g. \"adhd\", \"template\").",
          "items": { "type": "string" }
        }
      }
    },
    "user_profile": {
      "type": "object",
      "description": "The person's cognitive patterns and communication style.",
      "additionalProperties": true,
      "properties": {
        "cognitive_patterns": {
          "type": "object",
          "description": "Attention, processing, and memory patterns.",
          "additionalProperties": true
        },
        "communication_style": {
          "type": "object",
          "description": "Preferred directness, detail level, and formats.",
          "additionalProperties": true,
          "properties": {
            "directness": { "type": "string" },
            "detail_level": { "type": "string" },
            "format_preferences": {
              "type": "array",
              "items": { "type": "string" }
            }
          }
        }
      }
    },
    "interaction_preferences": {
      "type": "object",
      "description": "How the AI should shape responses, manage tasks, and support learning.",
      "additionalProperties": true
    },
    "data_governance": {
      "type": "object",
      "description": "User data retention, usage, and privacy preferences (privacy-first by default).",
      "additionalProperties": true,
      "properties": {
        "data_retention": { "type": "object", "additionalProperties": true },
        "data_usage": { "type": "object", "additionalProperties": true },
        "privacy_level": {
          "type": "string",
          "description": "Overall privacy posture for the document.",
          "enum": ["low", "medium", "high"]
        }
      }
    },
    "accessibility_needs": {
      "type": "object",
      "description": "Cognitive, sensory, and motor accessibility preferences.",
      "additionalProperties": true
    },
    "ai_agent_preferences": {
      "type": "object",
      "description": "Per-agent routing preferences keyed by agent name (e.g. claude, chatgpt, cursor, gemini, perplexity).",
      "additionalProperties": {
        "type": "object",
        "additionalProperties": true,
        "properties": {
          "use_for": { "type": "array", "items": { "type": "string" } },
          "avoid_for": { "type": "array", "items": { "type": "string" } },
          "custom_instructions": { "type": "string" }
        }
      }
    },
    "emergency_protocols": {
      "type": "object",
      "description": "Safety keywords, contacts, and escalation procedures.",
      "additionalProperties": true,
      "properties": {
        "safety_keywords": {
          "type": "array",
          "items": { "type": "string" }
        },
        "emergency_contacts": {
          "type": "array",
          "items": {
            "type": "object",
            "additionalProperties": true,
            "properties": {
              "name": { "type": "string" },
              "contact_method": { "type": "string" },
              "priority": { "type": "string" }
            }
          }
        },
        "escalation_procedures": {
          "type": "object",
          "additionalProperties": true
        }
      }
    }
  }
}
